{
  "changes": [
    {
      "outcome": "applied",
      "path": "src/auth.ts",
      "revision": "b1-30e217dafba8bae4b210e802479fb377"
    },
    {
      "outcome": "applied",
      "path": "src/session.ts",
      "revision": "b1-0983cd5a83f4775828da1580184f0f92"
    }
  ],
  "effect": "buffer",
  "planId": "plan-e810c8cf2fc667011ff17e280098bdb6",
  "state": "applied"
}
